{
  "$schema": "https://json-schema.org/draft/2020-12/schema",
  "title": "Atendimento CRM Core identity review batch",
  "description": "A UUID-only, owner-reviewed handoff. It is not a database command or a cutover receipt.",
  "type": "object",
  "additionalProperties": false,
  "required": ["contract", "batchId", "runId", "review", "links"],
  "properties": {
    "contract": { "const": "atendimento/crm-core/identity-review-batch/v1" },
    "batchId": { "$ref": "#/$defs/uuid" },
    "runId": { "$ref": "#/$defs/uuid" },
    "review": {
      "type": "object",
      "additionalProperties": false,
      "required": ["owner", "decision", "reviewerKeyId", "reviewedAt"],
      "properties": {
        "owner": { "const": "atendimento" },
        "decision": { "const": "approved" },
        "reviewerKeyId": { "type": "string", "pattern": "^[A-Za-z0-9._-]{3,96}$" },
        "reviewedAt": { "type": "string", "pattern": "^\\d{4}-\\d{2}-\\d{2}T\\d{2}:\\d{2}:\\d{2}\\.\\d{3}Z$" }
      }
    },
    "links": {
      "type": "array",
      "minItems": 1,
      "items": {
        "type": "object",
        "additionalProperties": false,
        "required": ["attendanceId", "canonicalClientId", "status", "method", "evidenceDigest", "sourceRevision"],
        "properties": {
          "attendanceId": { "$ref": "#/$defs/uuid" },
          "canonicalClientId": { "$ref": "#/$defs/uuid" },
          "status": { "const": "confirmed" },
          "method": { "const": "reviewed_reconciliation" },
          "evidenceDigest": { "type": "string", "pattern": "^sha256:[A-Fa-f0-9]{64}$" },
          "sourceRevision": { "type": "integer", "minimum": 1 }
        }
      }
    }
  },
  "$defs": {
    "uuid": {
      "type": "string",
      "pattern": "^[A-Fa-f0-9]{8}-[A-Fa-f0-9]{4}-[A-Fa-f0-9]{4}-[A-Fa-f0-9]{4}-[A-Fa-f0-9]{12}$"
    }
  }
}
