{
  "contract": "atendimento/crm-core/identity-review-batch/v1",
  "batchId": "10000000-0000-4000-8000-000000000001",
  "runId": "10000000-0000-4000-8000-000000000002",
  "review": {
    "owner": "atendimento",
    "decision": "approved",
    "reviewerKeyId": "synthetic-review-key-v1",
    "reviewedAt": "2026-09-15T12:00:00.000Z"
  },
  "links": [
    {
      "attendanceId": "20000000-0000-4000-8000-000000000001",
      "canonicalClientId": "30000000-0000-4000-8000-000000000001",
      "status": "confirmed",
      "method": "reviewed_reconciliation",
      "evidenceDigest": "sha256:aaaaaaaaaaaaaaaaaaaaaaaaaaaaaaaaaaaaaaaaaaaaaaaaaaaaaaaaaaaaaaaa",
      "sourceRevision": 1
    },
    {
      "attendanceId": "20000000-0000-4000-8000-000000000002",
      "canonicalClientId": "30000000-0000-4000-8000-000000000002",
      "status": "confirmed",
      "method": "reviewed_reconciliation",
      "evidenceDigest": "sha256:bbbbbbbbbbbbbbbbbbbbbbbbbbbbbbbbbbbbbbbbbbbbbbbbbbbbbbbbbbbbbbbb",
      "sourceRevision": 1
    }
  ]
}
